{
  "schema_id": "MusicPlan",
  "schema_version": "1.0",
  "loop_selections": {},
  "shot_overrides": [
    {
      "item_id": "music-sc01-sh01",
      "music_clip_id": "cher2:114.0s-142.1s",
      "music_asset_id": "music-sc01-sh01",
      "clip_start_sec": 114,
      "clip_duration_sec": 28.099999999999994,
      "start_sec": 5,
      "end_sec": 20,
      "duck_db": 0,
      "fade_sec": 0.15
    },
    {
      "item_id": "music-sc02-sh02",
      "music_clip_id": "cher1:126.0s-155.6s",
      "music_asset_id": "music-sc02-sh02",
      "clip_start_sec": 126,
      "clip_duration_sec": 29.599999999999994,
      "start_sec": 30,
      "end_sec": 35,
      "duck_db": 0,
      "fade_sec": 0.15
    }
  ],
  "track_volumes": {},
  "clip_volumes": {}
}
